<?xml version="1.0" encoding="UTF-8"?>
<actor xmlns:xsi="http://www.w3.org/2001/XMLSchema-instance"
 xsi:noNamespaceSchemaLocation="../xsd/ActorScheme.xsd">
    <class>Kreatur</class>
    <name>Kre</name>
    <HP>180</HP>
    <mana>10</mana>
    <posX>15</posX>
    <posY>16</posY>
    <posZ>0</posZ>
    <color>2</color>
    <weaponLname>
        <name>none</name>
        <damage>12</damage>
        <range>4</range>
        <defense>0</defense>
    </weaponLname>
    <weaponRname>
        <name>none</name>
        <damage>6</damage>
        <range>4</range>
        <defense>0</defense>
    </weaponRname>
</actor>
