<?xml version="1.0" encoding="UTF-8"?>
<actor xmlns:xsi="http://www.w3.org/2001/XMLSchema-instance"
 xsi:noNamespaceSchemaLocation="../xsd/ActorScheme.xsd">
    <class>Knight</class>
    <name>Knight</name>
    <HP>155</HP>
    <mana>2</mana>
    <posX>-12</posX>
    <posY>-2</posY>
    <posZ>0</posZ>
    <color>1</color>
    <weaponLname>
        <name>none</name>
        <damage>8</damage>
        <range>4</range>
        <defense>0</defense>
    </weaponLname>
    <weaponRname>
        <name>Sabre</name>
        <damage>10</damage>
        <range>3</range>
        <defense>0</defense>
    </weaponRname>
</actor>
