<?xml version="1.0" encoding="UTF-8"?>
<actor xmlns:xsi="http://www.w3.org/2001/XMLSchema-instance"
 xsi:noNamespaceSchemaLocation="../xsd/ActorScheme.xsd">
    <class>Knight</class>
    <name>Knight_005</name>
    <HP>155</HP>
    <mana>2</mana>
    <posX>29</posX>
    <posY>-62</posY>
    <posZ>0</posZ>
    <color>1</color>
    <weaponLname>
        <name>Roundshield</name>
        <damage>0</damage>
        <range>0</range>
        <defense>5</defense>
    </weaponLname>
    <weaponRname>
        <name>Longsword</name>
        <damage>14</damage>
        <range>3</range>
        <defense>0</defense>
    </weaponRname>
</actor>
