<?xml version="1.0" encoding="UTF-8"?>
<actor xmlns:xsi="http://www.w3.org/2001/XMLSchema-instance"
 xsi:noNamespaceSchemaLocation="../xsd/ActorScheme.xsd">
    <class>Orc</class>
    <name>Orc_0002</name>
    <HP>165</HP>
    <mana>10</mana>
    <posX>7</posX>
    <posY>12</posY>
    <posZ>0</posZ>
    <color>2</color>
    <weaponLname>
        <name>none</name>
        <damage>8</damage>
        <range>4</range>
        <defense>0</defense>
    </weaponLname>
    <weaponRname>
        <name>Longsword</name>
        <damage>14</damage>
        <range>4</range>
        <defense>0</defense>
    </weaponRname>
</actor>
